date,text,hash_tags
2020-09-01,"People are tired of watching the highly political . Basketball ratings are WAY down, and they won’t be coming back. I hope football and baseball are watching and learning because the same thing will be happening to them. Stand tall for our Country and our Flag!!!3.95.921.2",
2020-09-02,"We catch them all! TheBlazeAntifa 'commander' cried in 'fetal position' after being caught with flamethrower, smoke grenades on way to protest https://bit.ly/2YZrv2a72.711.1",
2020-09-02,You don't know what a productive anything isThanks for nothing1,
2020-09-02,Imagine boycotting every sport and business that stands by their black employees and permits peaceful protests.1,
2020-09-02," You like TV, right? There’s a casting call for the revised “I’ve fallen and I can’t get up” commercials. You can test for the part of . You’d be perfect. One take. Guaranteed. Believe me.1",['#Strokeahontas']
2020-09-02,"I don’t really want football back. I’m sooo disheartened by the NFL & NBA allowing terrorist organization, BLM, to takeover the game!2",
2020-09-02,Drudge sucks2,
2020-09-02,I’d have to double check if you said fire was hot4,
2020-09-02,"It's been 60 years since this country has seen this kind of violence, civil unrest, hatred and division. 60 years..Until  you came along.13",
2020-09-02,"No soup for you, Donald!Antifa Anti- against Fa- Fascism Thank you for coming to my Ted talk14",
2020-09-02,"Whatever you say, ",['#Strokeahontas11']
2020-09-02,"Trump is not with Kenosha, but with out-of-state killers, imported antagonists, and dirty cops. Don't let  attack your city.  kills.27","['#TrumpGestapo', '#TrumpVirus']"
2020-09-02,"1. People watch  we don't care what the ratings are. 2. Same with Football and Baseball (we LOVE you)3. Stand for what you believe. People fought and died so we can be free away from tyranny and fascisms. Over 4 family members died in WWII, still in those ships at sea.1",
2020-09-02,Thank you for coming!!12,
2020-09-02,"Heading to Kenosha, Wisconsin, to thank Law Enforcement and the National Guard for a job well done. The Violence stopped six days ago, the moment the Guard entered the picture. Thank you!1.52.613.1",
2020-09-02,Don’t you know it’s not polite to show up at a party you to which you haven’t been invited? Go golf. It’s the only time we’re really safe from you.2,
2020-09-02,There is something wrong with you.2,
2020-09-02,"The article headline literally, ""Trump denies mini-strokes..."" the fact you've felt it necessary to reply gives the article credence.1",
2020-09-02,trumps presidency is what caused the destruction in Kenosha. Period.3,
2020-09-02,"if someone has diabetes and was shot multiple times in the chest with an ar 15, do we go back and say they died from diabetes? no. this is every bit as nonsensical as my example",
2020-09-02,You????????? Favorite???? You ARE unwell!  The FAVORITE President of the USA is !12,
2020-09-03,They’re probably going to give him the debate questions ahead of time also13,
2020-09-03,"Governors Andrew Cuomo of New York has the worst record on death and China Virus. 11,000 people alone died in Nursing Homes because of his incompetence!3.44.617.4",
2020-09-03,Is that why you had a wall built around the White House? Did Mexico pay for that?9,
2020-09-03,"Imagine how high it would be if Hillary had won. Everyone is saying it would be over 30,000!. And we wouldn’t have a pandemic killing 100s of thousands of us. You are a failure.1",
2020-09-03,"Let’s start with MEXICO didn’t pay for the wall, Hillary didn’t go to prison and after inheriting a great economy and a much lowered national deficit from OBama, we’re now in a recession, and the national deficit has tripled1",
2020-09-03,"Promised to lock up Hillary, better healthcare, still no plan, drain the swamp yet 13 of his workers and cabinet members now in prison, mexico no pay, no one is winning, so busy he wont have time for golf, promised trade wars would be won, promised we would all be so rich.1",
2020-09-03,"Trump supports & encourages domestic terrorists... he’s a terrorist-sympathizer... & a POS!! ... WE will defeat Trump in November! Don’t let his bots and “pro-Trumper/foreign interference accounts convince you otherwise… Trump is going to lose, if we vote!! Oh yea, Fuck Trump!!1",
2020-09-03,"Breitbart again?  You told that lie about Hillary!  I’d ask what the fuck is wrong with you, but you’ll just do or say something more stupid and make me guess again.1",
2020-09-03,You are the biggest lier on the planet!11,
2020-09-03, I am only just pretending o hope you understand  love you!! Alice. https://youtu.be/DcFUzAgeChg22,
2020-09-03," So sir I have been borrowing your name just when I need to get a Coffee with my ex husbands phone number “Alice Trump”  as I am not for the New Australian Nazi rules, I hope you don’t mind . MASKShopping adventures with a  mask  I don’t suggest using a sharpie to write your msg  Definitely a higher chance of me dying of breathing in the i...youtube.com61941","['#PIZZAGATE', '#PIZZAGATE']"
2020-09-03,They are scared. They run ads to convince themselves! We don’t need to convince ourselves because we already know the truth. Don’t think about the ads. Do your thing! WIN!!!12,
2020-09-03,That’s how Biden will debate also.  He wants questions ahead and he will read the teleprompter. ,['#HidenBiden23']
2020-09-03,Charge them Domestic terrorism and send them to GITMOThere's plenty of room...Obama cleared it out for you3,
2020-09-03,"Who gives a fuck - millions of people are struggling to feed their kids, can’t pay rent, can’t pay mortgage, free food lines are stretching for 20 blocks, people are waiting in line for 5-6 hours to get a box of food, wake up asshole and smell the fucking coffee2",
2020-09-03,Love from Australia  Alice. https://youtu.be/DcFUzAgeChg14,
2020-09-03,Biden’s new nickname should be Hiden’ Biden.3,
2020-09-03, don't forget about loser ! Defund Chicago as well!No bailouts! Jim Hoft27,
2020-09-04,"Why aren’t the Portland Police ARRESTING the cold blooded killer of Aaron “Jay” Danielson. Do your job, and do it fast. Everybody knows who this thug is. No wonder Portland is going to hell! 2.53.313.9",
2020-09-04,"  ,   2  no doubt another boring as hell “yay me” eventbetter than any other sleep aid2",
2020-09-04,Jacob BlakeGeorge FloydBreonna TaylorShould I go on?2,
2020-09-04,She isn’t a sneaky criminal like you. You go out of the way to hide the million things you do wrong.13,
2020-09-04,"What I don't want is a potus that can be set up by Kim! Dumb enuf to not only fall in love, but lacks the ability to know not to say that! A potus that doesn't salute dictator staff! NOT EVEN A REAL DICTATOR, his staff.  Work on yrself potus embarrassment!  I'll wait, 30 days!213",
2020-09-04,Voter intimidation much?15,
2020-09-04,False prophet. MAGA is the mark of the beast2,
2020-09-04,"  ,   2  Another word salad? Geeeee,sure something to enjoy...1",
2020-09-04,"He's so proud that the unhinged support him! Well, guess what? You have to be unhinged to support him!2",
2020-09-04,"  ,   2  Trump is a traitor to our troops.Trump: Americans Who Died in War Are ‘Losers’ and ‘Suckers’The president has repeatedly disparaged the intelligence of service members, and asked that wounded veterans be kept out of military parades, multiple sources tell The Atlantic.theatlantic.com114",
2020-09-04,"  ,   2  I heard that Biden decided to leave his basement and go to Kenosha. Too late, Joe.21",
2020-09-04,Where's the Inquisition when you need them?Here's your daily reminder. You have been forever IMPEACHED AND DISGRACED!,['#TrumpVirusDeathToll186K23']
2020-09-04,"To be fair, New Jersey is slightly worse.COVID deaths per million:New Jersey: 1,810New York: 1,699San Marino: 1,237 (highest in world, for a country)23",
2020-09-04,"  ,   2  This is Trump at his best. Enthusiastic, all over, unscripted, not serious, entertaining and the crowd loved every minute.2",
2020-09-04," has the nerve to disrespect veterans, dead AND alive, while not one person in his entire family has served.Current location of  and : Loserville1",
2020-09-04,Americans should demand International monitoring in the election. This President had overtly sought to suppress voters who have disagreed with him.117,
2020-09-04,Mask is Joe Biden’s security blanket.16,
2020-09-04,". Polls are, as in the past, Fake News. They have been from the beginning, way off in 2016. Get a new pollster. I believe we are leading BIG!2.12.511.5",
2020-09-05, What US President has done more for the US MILITARY & VETERANS than Donald J. Trump? Pete ButtigiegWhen we have a president who knows what it’s like to send a loved one overseas it wont just be talk—it will be personal.11,
2020-09-05, has confirmed key elements of the Atlantic story. Let that sink in! You only use the military as props!Shame on you! Shame!1,
2020-09-05,"HORSE PUCKY. Do U Stand by your claim, ""Only Criminals Take The 5th.""          Soon the Headline Will B:    ","['#SonEricTakesThe5th', '#TrumpIsTheVirus', '#SaveTheUSPS', '#BLM', '#TrumpsJawsonTakesThe5th', '#86the45', '#MakeJrTakeThe5th', '#45WillTakeThe5th', '#TrumpsAllTakeThe5th', '#WheresMyCovidTest', '#Subrosas4Trumps1']"
2020-09-05,"Not any more! Ian Miles CheongCritical race theory is the greatest threat to western civilization and it’s made its way into the US federal government, the military, and the justice system.1.43.410.6",
2020-09-05,2 Anonymous sources claimed they saw  eat my last piece of candy.1,
2020-09-05,"Exclusive: Nearly 700 U.S. Veterans Issue Open Letter in Support of Trump https://breitbart.com/politics/2020/09/04/exclusive-nearly-700-u-s-veterans-issue-open-letter-in-support-of-trump/… via  Thank you! As we get closer and closer to the November 3rd Election, and as my poll numbers rocket up, the attacks get more and more vicious. I love our HEROES!Exclusive: Nearly 700 U.S. Veterans Issue Open Letter in Support of TrumpNearly 700 American veterans have issued a letter affirming their support of Trump against establishment media attacks.breitbart.com1.82.36.9",
2020-09-05,"Owner of Salon Visited by Pelosi Raises over $220,000 on GoFundMe https://breitbart.com/politics/2020/09/04/owner-of-salon-visited-by-nancy-pelosi-raises-over-220000-on-gofundme/… via . Great!!!Owner of Salon Visited by Pelosi Raises over $220,000 on GoFundMeFormer Nevada State GOP chairman Amy Tarkanian has raised over $220,000 for Erica Kious, the owner of the salon Nancy Pelosi attended Monday.breitbart.com7.31.97.2",
2020-09-05," When the President defends himself, he has PROOF.I love him more each day.2",
2020-09-05,Then he has no Respect for our Military Men and Women story even verified by his propaganda network Fox! Was going to close Stars and Stripes down but Changed his mind because he’s trying to save his neck!14,
2020-09-05,"Now admit you're completely incompetent and making stupid decisions is in your DNA. Nah. I didn't think so. ""Everybody knows it"" though.     ","['#TrumpHatesOurMilitary', '#TrumpIsALoser', '#incompetent', '#TrumpMeltdown', '#TrumpVirusDeathToll186K1']"
2020-09-05,"Speaking of thugs, did you investigate you buddy Putin putting bounties on American Soldiers heads?2",
2020-09-05,"Why the backtracking, ? We know you were behind this. Was it a step too far for even the most rabid of your active duty and veteran  supporters?   ","['#BenedictDonald', '#MAGAt', '#TrumpHatesOurMilitary', '#TrumpResignNow', '#TrumpIsALoser11']"
2020-09-05,"I am proud of all you do Mr. President, despite the constant vitriol and lies thrown at you.You continue to work tirelessly for a better country for All AMERICAN people. Prayers for your family. God bless  our country. 1211",
2020-09-05,Another day everyone thought would be impossible! Congratulations to  Vucic of Serbia and PM  Hoti of Kosovo on committing to ! This is a major step forward...2.91.66.8,['#EconomicNormalization']
2020-09-05,Your campaign just died.13,
2020-09-05,"Your Twitter Poll isn't looking so good with 85/86 million followers and under 80K likes - Is so weird   Maybe the other 84+ millions of twitwits following you are your so called ""silent majority""  ?12",
2020-09-05,I believe that you are batshit crazy.15,
2020-09-05,"A sad spectacle yesterday in the White House press briefing roomThe Lazy Lies of President ChaosYou want some convenient examples of why Donald Trump is not fit to serve as president of the United States? I know, it’s not as if anybody needs even more. But yesterday’s White House press briefing...thebulwark.com14",
2020-09-06,Congratulations to the U.S. Marshals on a job well done in Portland. LAW & ORDER!1.4422.2,
2020-09-06,"I suppose that's one way to make up for losing money during a Pandemic, setup the Speaker of the House and go on FOX News. Is she gonna be your next girlfriend too?12",
2020-09-06,We all know that you lie and say horrible things about almost everyone but yourself.  Grow up and become a man.1,
2020-09-06,Fox is the New CNN since they got bought out! Tucker and his crew need to move to  !!!22,
2020-09-06,"Unlike YOU there is proof that it was a ‘setup’ Still waiting on that DNA Sample to prove you didn’t rape Hairstylist Backs Up Nancy's Story, Claims Salon Owner Has Been Operating Indoors Illegally for...The drama escalated after the stylist who had taken the appointment with the speaker issued a statement — through a lawyer — laying out a few claims of his own about Erica Kious, the salon owner who...sfist.com1",
2020-09-06,"Dude, you got played by all 3 of them. 4",
2020-09-06,"Yes, i am planning on gettin ""set up"" by buying a boat. Think my wife will go for that excuse?4",
2020-09-06,Watched this scared to death. Day later Trump ENDED...another Obama seed!!Love president Trump!13,
2020-09-06,"Department of Education is looking at this. If so, they will not be funded! Ocitmancalifornia has implemented the 1619 project into the public schools. soon you wont recognize america1.63.18.7",
2020-09-06,"You see Lou Holtz, Rush Limbaugh, Tiger Woods, etc as heroes, not those who sacrificed and gave their all for America. We all know how you really feel especially about disabled. I could easily find 700 vets who don't feel that way just in response to a couple of your tweets.2",
2020-09-06,Do you mean Michelle Obama?13,
2020-09-07,"  *It's A Felony Telling People: To Vote Twice!! It's Fraud If You Do Vote Twice! BrooklynDad_Defiant!Donald trump is STILL encouraging his supporters to vote twice. What kind of shithole loser ""president"" intentionally tells his supporters to commit a FELONY?11",
2020-09-07,"This HERO survived Pearl Harbor and Iwo Jima, but your    negligence and incompetence killed him  .    FacesOfCOVIDROBIN BARRETT, 95, of Oregon died of COVID-19 in April.He joined the Marines at age 17 after the attacks on Pearl Harbor, and later fought at the Battle of Iwo Jima. After the war he raised a family and worked in sales and as a Little League coach.https://kgw.com/article/news/health/coronavirus/world-war-two-veteran-robert-barrett-dies-of-coronavirus-at-oregon-veterans-home/283-cb8d07fd-3c7a-4da9-b302-189432785763…1","['#TrumpVirus', '#TrumpHatesOurVeterans', '#TrumpIsALoser', '#WeRespectOurVets트윗']"
2020-09-07,Love love love that people find this stuff.  Got to wonder what happened back in 2013 that solidified their friendship. It must have been golden!11,
2020-09-07,What does their lack of political support have to do with football? Maybe they have more pressing issues??1,
2020-09-07,"If they can't protest without making a fool of themselves, I dont think I care very much about their opinions and ideas.2",
2020-09-07,  I can't get our Patriots to agree to have a MASK BURNING PARTY all day tomorrow to throw this hoax right back in the Demoncrats Faces. What say you sir? No more Mask Madates?  PLEASE SIR I need your help to get everyone to join us!11,
2020-09-07,Can you watch some other show? I agree it is very good one but try some variety. I don't post KISS everyday. It gets tedious after awhile.1,
2020-09-07,purr besty2,
2020-09-07,"Great video, Why the Left on both sides of the Atlantic keep losing, and will continue to lose.The Left has become so extreme, that their moderate supporters are walking away.They realise they have become the bad guys.23",
2020-09-07,Yes it will be when you are out of our house.2,
2020-09-07,"The bankruptcy of the leftist elite takes place by flushing dollars down media toilets. Flushing meadows of lies, not worthy to use for compost.12",
2020-09-07,"God Bless Them All . Our President Stands With and Supports Our Veterans, he has Much Love and Respect for Our Military.  2",
2020-09-07,I think everyone sees it clearly it this point.  Some just choose to not care because they hate trump that much.13,
2020-09-07, Hey Joe.....the DEMS are just propping YOU and trying to do the sequel “Weekend at Biden’s!!!”1,
2020-09-07,"Notice at the end, it's a POLICE OFFICER with a fire extinguisher who puts out the fire.",['#BackTheBlue14']
2020-09-07," developed despite its very weak  ,  fell after the end of the , despite the fact that its economy was the  in .The 's economy is not the only  of your strength and ","['#Singapore', '#economy', '#Germany', '#FirstWorldWar', '#strongest', '#Europe', '#country', '#evidence', '#success1']"
2020-09-07,"This is not a failed episode of , these are people’s lives you fool 1",['#theapprentice']
2020-09-07,Beb let me feed you and i eat from your mouth  uummahh1,
2020-09-07, they get what they deserve3,
2020-09-08,Takes too long to fact check since you lie so much.4,
2020-09-08,Love ur school girl nicknames. Ur so clever. U pos.3,
2020-09-08,190000 dead Americans due to a weakly run executive branch...record unemployment...Russian interference...USPS in shambles...We get the fucking picture.   ,"['#TrumpVirusDeathToll193K', '#SaveThePostOffice', '#TrumpHatesOurMilitary', '#BountyGate22']"
2020-09-08,"Based on their bad ratings, so would many! thebradfordfile™I would much rather watch a Trump rally than an NBA game. And it's not even close.41.25.5",
2020-09-08,"Maybe as a leader- sarcasm, joking, insinuating, and Lying shouldn’t be used when taking policy, to the press or any kind of official communication at all.   The time your wasting is funded with OUR money. Keep a lid on it until your a private citizen.  ","['#POTUS', '#RealDonaldJTrump1']"
2020-09-08,Promises made Promises kept.  You have my vote President Trump!4,
2020-09-08,"The Real Polls are starting to look GREAT! We will be having an even bigger victory than that of 2016. The Radical Left Anarchists, Agitators, Looters, and just plain Lunatics, will not be happy, but they will behave!3417.5",
2020-09-08,"You don't count the people who went back to work after being furloughed, you nitwit. They were furloughed, bc of the horrible way you've handled the Trump Virus. If you had shut down for 3-4 weeks & told your base to wear masks, the U.S. wouldn't have 190k dead & 30M unemployed.2",
2020-09-08,That’s exactly why CNN is not allowed in my house.   Bullshit news = CNN6,
2020-09-08,woohoo!1,
2020-09-08,Thank you....we need serious intervention here in California.11,
2020-09-08,None of them should air your ridiculous press conferences424,
2020-09-08,"How about John Kelly himself? I don’t think I’ve heard HIM deny it. Hmmmm....after you said those oh-so-kind words about him, I wouldn’t be surprised if some more pieces of the “iceberg” tumble down tomorrow!",
2020-09-08,CNN is all fake news people and I agree Mr. President..23,
2020-09-08,"Exclusive: Zach Fuentes, Top Aide to John Kelly, Denies Atlantic Story About Trump https://breitbart.com/politics/2020/09/07/exclusive-zach-fuentes-top-aide-to-john-kelly-denies-atlantic-story-about-trump/… via  Thanks Zach. Just more corrupt Fake News trying to change the course of our most important, ever, Election!Exclusive: Zach Fuentes, Top Aide to John Kelly, Denies Atlantic Story About TrumpFormer Deputy White House Chief of Staff Zach Fuentes denied to Breitbart News The Atlantic’s account of President Donald Trump’s comments about troops.breitbart.com1.11.54.4",
2020-09-08,"Lolololololol. Like people who pronounce things as Thighland, Yo-semite, plosma, and surburbs1",
2020-09-08,The hell with Dustin johnson I'm still hurting and that piss asd munchkin says bail out airline but no stimulus check. Here's my answer I'm voting biden maybe he can help us you have decided not to1,
2020-09-08,"Trump is the fake news , 10 million RETRUN to their old jobs , this Fking BSer is suicide for USA Trump is History one way or the other ! 20201",
2020-09-08,"So,  you're a ""true winner"" if you win a golf game,  but a ""loser"" if you lay down your life for your country or disagree with the president?  Got it.2",
2020-09-08,"Today you insulted our military as your proof that you didn’t previously insult our military. Coke’s a hellava drug, Komrade Bonespurs.  ","['#TrumpHatesOurMilitary', '#TrumpHatesOurVeterans']"
2020-09-09,You are suppose to root for America to succeed not gloat and denigrate if they don’t. I bet is wrong with you? I can’t wait until the SDNY locks your ass away!!11,
2020-09-09,“liar”..........for someone that can’t spell the word knowing he does it every day makes this even funnier. Thanks for the laughs Agolf Twitler.,
2020-09-09,"Me too, President Trump is so entertaining and at the same time giving us important information.1",
2020-09-09,Does that spell Zozo? So it’s trump zozo?? I’m sure it has special meaning for all the QANON freaks.11,
2020-09-09,If you have plane trouble just jump! I know you think you need a parachute but that's just a Dem hoax like Covid was. Don't let them get you! Jump!!!1,
2020-09-09,Are you STILL TWEETING ?? 11,
2020-09-09,Cuomo and de Blasio are committed to turning the beautiful State and city of New York into a dilapidated Marxist 3rd world toilet.    ,"['#NewYork', '#America', '#USA1']"
2020-09-09,Too bad. About the landing part.5,
2020-09-09,Will you protect American lifestyle and not be part of the new world order agenda?32,
2020-09-09,Why didn’t “Suburbia” disappear in the 8 years before you?14,
2020-09-09,"Ok enough whinnying. I have yet to here your plan for the Election. No surprise there since you never have a plan. Case in point how is that replacement of ObamaCare coming along. What did you say, that it would be so easy. You would have it done in 2 hours after U were elected.2",
2020-09-09,I doubt most of NC cares!!11,
2020-09-09,"They are not “peaceful protesters”, as Sleepy Joe and the Democrats call them, they are THUGS - And it is all taking place in Democrat run cities. Call me and request Federal HELP. We will solve your problems in a matter of minutes - And thanks to the U.S. Marshalls in Portland!1.83.512.9",
2020-09-09," Doesn’t sound like a mass “retirement” to me,  ; it’s a MASS RESIGNATION.And you’re cheering Rochester’s loss of an African-American police chief.ROTTEN  ...Rochester police leaders retire after suffocation deathwnyt.com13",['#MockingbirdMedia']
2020-09-09, Canada is in trouble. Corrupt politicians in power True North12,
2020-09-09,That's how it should be! Great Polls coming in. Nobody in their right mind will vote for candidates that supported violence and mayhem!Never!124,
2020-09-09,Lies.  You created it.  Why would you want to fix it.  It's your mess.  Let the adult in the room clean it up.  Joe Biden.6,
2020-09-09,Domestic terrorist38,
2020-09-10,"And, because of the incompetence of Trump, the failed president of the United States, tens of thousands of people have died of the coronavirus.25",
2020-09-10,"These are my real words about our GREAT HEROES, not made up lies by the enemy. THANK YOU and God Bless You All!227 0:05 / 2:303.43.69.1",
2020-09-10,Liar in chief!11,
2020-09-10,"You are a failed president! You failed 190,000 people!11",
2020-09-10,Do you really think the KKK and white suburbia is going to save your ass?3,
2020-09-10,"Does Hannity prefer the Black or Caspian seaside for his ""retirement"" plan?14",
2020-09-10,"Buckle up Buttercup, it’s only just begun.  All I know is, everything said and written by the left MSM is lies and more lies.  No one can change my VOTE!!!   429",['#StandwithTrump']
2020-09-10,Snyder was really bad in Michigan as a governor. The people will not forget the Flint disaster in MI.49,
2020-09-10,"You’ve told over 20,000 lies (well that was last week when I checked so it’s probably higher). You love causing fear so no one believes you didn’t say anything to prevent panic. 189,000 dead from  & that’s on you. ","['#TrumpVirus', '#TrumpKnew114']"
2020-09-10,...These are horrendous people that we must defeat on November 3rd!7.81.46,
2020-09-10,We won't be watching Hannity....11,
2020-09-10,Thanks for the head's up. We will have fact checkers on standby.3,
2020-09-10, Pass it on.23,['#TrumpKnewVoteBlue']
2020-09-10,"Only in your world would you have to pivot back to the other shameful story that makes you look like a monster, because today's is so much worse!2",
2020-09-10,I will be watching  tear you a new one.13,
2020-09-10,"Donald calls US Citizens ""enemy"".  He called for the systematic persecution of Lt. Col. Vindman, a purple heart recipient, who's only crime was to answer a lawful subpoena and answer questions honestly. Not satisfied with this act of petty revenge, he also trashed the brother.124",
2020-09-10,"Trump. This country is big and powerful, but not enough to withstand the looting by you and your pals. You can’t do Your Thing then go your merry way and good ol’ America will be fine. Look around. It’s all going to hell. We aren’t going to be fine. You’ve wrecked the USA.513",
