date,text,hash_tags
2020-09-20,Your falling in the polls so much that you will loose by election. Day2,
2020-09-20,President Trump is of for and by the people.Rallying for President Trump and VP Pence while supporting Law & Order in West Seneca NY today 9/19/201,
2020-09-20,No thanks! Alaska Chamber.71.45.6,['#AKFallForum20206']
2020-09-21,New England playing Seattle or Mark Levin? Seriously?  Ya'll having a seance? Heard Jean Dixon was trending.1,
2020-09-21, and our county board of election doesn't recommend mailing them in. They have a schedule set after October 6 to go to their office to vote. Telling us the we can vote November 3rd also at our precinct?11,
2020-09-21,"Bill Gates just talked about the poor job that the US did with preventing the spread of covid... he explained it quite well. Hope they cover the same issues with you, although expecting anything other than lies, is wistful thinking....5",
2020-09-21,Ordering us to “enjoy” an interview with you is like ordering us to enjoy liver and onions.1,
2020-09-21,"Have you ever heard of parler? You should go there, that's where your followers are.1",
2020-09-21,"Virtually nobody in Alaska gives a damn what Trump thinks, wants, or cares about.  They’re worried he will trade Alaska back to Russia.2",
2020-09-21,1,
2020-09-21,"  ,   2  Can't wait!!!  We love our POTUS!!!!13",
2020-09-21,"I never thought I’d live to see the day where democrat  politicians would brazenly engage in treason, sedition, libel, slander, fake documents and manufactured conversations to topple the best president in my lifetime...Time to start holding them accountable Mr. President...11",
2020-09-21,Little Donald is a blowhard without a healthcare plan or a plan to get COVID-19 under control.2,
2020-09-21,"I would rather have gangrenous nostrils with a tapeworm boring into my septum while having root canal surgery w/out anesthesia along with spiders placed in my hemorrhoids & being forced to wear leprosy infected polyester. So, NO. The thought of you is worse than radiation burns!13",
2020-09-21,We'll enjoy watching you struggle to read the teleprompter.43,
2020-09-21,"I met with the DOJ concerning the declassification of various UNREDACTED documents. They agreed to release them but stated that so doing may have a perceived negative impact on the Russia probe. Also, key Allies’ called to ask not to release. Therefore, the Inspector General.....9.31.44.9",
2020-09-21,Get rid of Donald J Trump.111,
2020-09-21,No thanks4,
2020-09-21,"I'll take my chances, pack your bags.4",
2020-09-22,https://twitter.com/henryhooddavis/status/1308178550084833280?s=21….         haha  release the kraken!    .1,
2020-09-22,I wonder how many more people your rallies will kill?2,
2020-09-22,This is the very coolest! I love to love ! Makes me proud!    ,"['#Trump2020LandslideVictory', '#VoteRedLikeYourLifeDependsOnIt', '#VoteEarly', '#WalkAwayFromDemocratsForeverGIF13']"
2020-09-22,The hypocrisy is truly mind blowing. The GOP will too ethics and morals to the side in order to fulfill their agenda. We need  and others to speak out against this!1,
2020-09-22,Everyone knows Trump hasn’t read a book in his life! He is barely literate.11,
2020-09-22, DEMOCRATS GONE APE Feinstein Released Altered FBI Documents posing as such a transparent honorable Senator.  is a Fraud like     ALL IN CAHOOTS TO KEEP THEIR MONOPOLY ON CORRUPTION ,"['#NancyPelosi', '#Biden', '#Schumer', '#Nadler', '#OhioForTrump', '#TrumpRallyOhio12']"
2020-09-22,"You shouldn’t work so hard. Everyone loves you, and you will have a landslide victory in Nov.   Trump 202014",
2020-09-22, a woman would be great but Leo Terrell would be awesome !  I’d love to see the Dems smear him and expose their hypocrisy.14,
2020-09-22,Please Lord get President Trump safely to the next rally in Toledo Ohio.4314,
2020-09-22,SO PROUD of President Trump!  TWO HUGE “protests” today because he LOVES us as much as  Please come to Alabama  !!!!  I have to make it to a  Thank you for all you do for US!,"['#WeLoveTrump', '#TrumpRally', '#GodBlessTrump26']"
2020-09-22,Wow those Craigslist and facebooks are are really bringing them in for your superspreaders. You should really pay them more for going without a mask.114,
2020-09-22,Wait. Who’s acting as president while all this tweeting is going on?2,
2020-09-22,The way democrats treated Kavanaugh resulted in 4 pat Senate seats.  +21,['#FillTheSeat']
2020-09-23,Hawking books keeping you busy? Because I am still waiting to read that beautiful health care plan of yours.2,
2020-09-23,So now that the courts are stacked with conservatives are you moderate (non cult worshippers) republicans now satisfied with the status quo and finally vote this unstable whack job out of office before he goes too far for even you?1,
2020-09-23,What pride do you have in this country when you've done everything to destroy it? Millions of Americans are unemployed and at risk of becoming homeless and hungry because you said the virus was a hoax. The blood of America is on your hands. America deserves better.1,
2020-09-23,Are these just transcripts of her interviews with you? How nauseating!1,
2020-09-23,Why do you insist tearing pieces of the progress made through the years? You are reverting accomplishments made through the years for what purpose? You continue to divide America instead of trying to let it heal . ,['#ResignNowTrump1']
2020-09-23, Someone just posted on Facebook that Biden has been wearing a earpiece when being interviewed etc..: Don’t allow him to have an earpiece in when you debate him. My birthday is the day of your debate with him! I can’t wait to see you debate him. 1,
2020-09-23," just so you know,  always swings their cameras and show the crowds at your “peaceful protests”! Give them a shoutout. 11",
2020-09-23,"Not as big as some of the other parades. We have cornfields instead of water. But small town Illinois s You!!! Enjoy!!!Log into Facebook | FacebookLog into Facebook to start sharing and connecting with your friends, family, and people you know.m.facebook.com1",
2020-09-23,"Looking forward to the day, you are cross examined in court..19",
2020-09-23,"How about the blue states stop paying federal taxes and just bail themselves out. If the red States are doing so well, they don't need blue state money. Right?11",
2020-09-23,Safe Travels Mr. President! 6,
2020-09-23,"On my way to Pennsylvania, see everyone soon!  White House 3.28.14.3",['#MAGAThe']
2020-09-23,Truth is kryptonite to Republicans.114,
2020-09-23,Don’t worry this will be the largest turnout in history and the more people the worse for you13,
2020-09-23,The so-called POTUS is once again admitting that he only cares about Republican states.1118,
2020-09-23,Really pushing it can't wait to see president Biden wupp your azz313,
2020-09-23,I would suggest these books.  The Liddle’est President might be a book you won’t need someone to read to you.1111,
2020-09-23,"As long as you are in office, there is no pride in country, only shame.1",
2020-09-24,These baseless factless exaggerated statements are an embarrassment to  but so so typical. Constant deceit and distraction. 2,
2020-09-24, President Trump will go down in history as the best President ever!  THANK YOU PRESIDENT TRUMP!11,['#KAG2020TRUMPVICTORY']
2020-09-24,Just heard about your son .  It's about to get real interesting now!  ,"['#CrookedTrump', '#WheresEric2']"
2020-09-24,LAW & ORDER!4.5524.1,
2020-09-24,Southern Florida is a lock.  ,['#4MoreYears2']
2020-09-24,Your 7 minutes of your rhetoric is the best 7 minutes of a snake oil salesmen I’ve ever seen. You are a smooth operator DJT! Too bad your personal lifestyle doesn’t live up to your rhetoric! There’s too much toxicity in your administration to make up for SOME of your positivity!1,
2020-09-24,"Now I have to fact check whether there's an actual 'bay of pigs vets assoc.',  and if so,  I have to contact them and give them hell.   Trump and his administration IS the bay of Pigs.412",
2020-09-24," should just hand over all the operations of Covid and let's see what this genius   can do with it CHIZIf Joe Biden has all the answers on Coronavirus, why didn’t he share them with President Trump to save American lives?1",
2020-09-24," I lost this , blown off my head in the middle of Hurricane Sally.  Three days later my dad found it 2 streets over. I was so upset when I lost it, but now I'm proudly wearing it again with some wear and tear but I love it and Pres. Trump1",
2020-09-24,What a load of crap.16,
2020-09-24,"You don't run with the good folks, donald.3",
2020-09-24,More trump kkk clan members have contracted the trump virus including Missouri Governor Mike Parson.4,
2020-09-24,"Will you please do something with that neck, put a maxi pad or something over it115",
2020-09-24,She sounds just like John.The McCain's must have lost huge $$ betting against ,['#AmericaFirst21']
2020-09-24,HITLER 123,
2020-09-24,I know someone who left Cuba in 60s with her family. She says everything you’re doing is same as what Castro was doing. You’re the one going down Communist path. You’re Putin’s puppet.14,
2020-09-24,"Uncaring and determined to undermine the Democratic governor, the conservative state Court agreed with the Republicans and ordered on-site voting, which could have led to surge in infections. Not done, several weeks later.A Trump Puppet!22",
2020-09-24,  Google Translate: “Kamala” means horrible in Finnish ,['#KAGA2020106551']
2020-09-25,"  ,   2  Coronavirus likes this.4",
2020-09-25,Why is Wray still there? ,['#DrainTheSwamp3']
2020-09-25,"  ,   2  “VOTE HIM OUT! VOTE HIM OUT!”3",
2020-09-25,Democrats are Rigging our 2020 Election!2.43.37.7,
2020-09-25,"Russian Mob Boss gave Trump billions to bail him out of bankruptcies. This on top of all the other money he received by abusing the emoluments clause, stealing from his campaign fundraising, etc while he's P. Crooked and evil as can be, but Fake Republicans protect him.3",
2020-09-25,"No! You’re not doing any of that, dictator wannabe. Btw looks like the senate is backing up a peaceful transition oh power when you lose. Haha!1",
2020-09-25,TRUMP KNOWS...he always knows!225,
2020-09-25, Wow!  How special is she  Liz Wheeler69.4 0:05 / 2:1823,
2020-09-25,Are you really the stupid or do you think we are?  The ACA (the law of the land) ALREADY covers pre-existing conditions. You and your GOP enablers are fighting against pre-existing conditions before the SCOTUS. ,['#LiarInChief2']
2020-09-25,"Better share some money with Lindsey, he is on Fox begging for it.29",
2020-09-25,"  ,   2  It's disturbing that you take such delight in crowds of people not practicing social distancing, when you just a few days told a reporter that they were too close and to back up. You clearly know how important social distancing is yet you encourage others not to do it.4214",
2020-09-25,If you are referring to the position of your head relative to your ass I quite agree.115,
2020-09-25,Tell your murderous thugs and Nazi goons. ,['#TrumpsAmeriKKKa2']
2020-09-25,You are so insanely ridiculous113,
2020-09-25,Fraud & Bankruptcy4,
2020-09-25,"  ,   2  Really? No chants of                           ","['#VoteHimOut', '#VoteTrumpOut', '#VoteHimOut', '#VoteTrumpOut', '#VoteHimOut', '#VoteTrumpOut', '#VoteHimOut', '#VoteTrumpOut', '#VoteHimOut', '#VoteTrumpOut', '#VoteHimOut', '#VoteTrumpOut', '#VoteHimOut', '#VoteTrumpOut', '#VoteHimOut', '#VoteTrumpOut', '#VoteHimOut', '#VoteTrumpOut', '#BidenHarris2020610']"
2020-09-25,Up BIG in South Carolina!12.113.9,
2020-09-25,"How is the crooked tax thing you have going on going?  How   scandal going?Have you chosen which prison you do 'not' want to go to? 200,000 PLUS people have died from Covid-19 because of your incompetence.","['#BidenHarrisToSaveAmerica', '#JoeBidenKamalaHarris202011']"
2020-09-25,"  ,   2  Florida gal here!  This tweet is Fake News!212",
2020-09-25,VOTETHEFUCKEROUT3,
2020-09-26,"Put me at the end of that list also. As you know everybody says that you, donald, can’t be trusted. So a vaccines approval rushed by your administration, especially if it’s before the election, should be viewed as suspicious. ",['#buyerbeware3']
2020-09-26,New York was hit hard because travel from Europe wasn’t stopped. tRump knew how bad it was and failed to warn the public or give the governors time to prepare. We could have gotten a jumpstart on PPE and ventilators.  tRump was golfing and holding rallies. ,['#TrumpVirus11']
2020-09-26,"America will be very happy if that vaccine is tested on Trump & a host of  frauds. It's not just  that won't be taking the vaccine, 60% of Americans won't be taking the vaccine too.3 days ago Trump called the  heavily politicized, today he wants NY to trust them.1",['#NewYork']
2020-09-26,"THANK YOU VIRGINIA! :31Team Trump (Text VOTE to 88022)LIVE: President Donald Trump in Newport News, VA .tv7.628","['#MAGA6', '#Virginiapscp']"
2020-09-26,"Mr President: Re SCOTUS pick-Check out Robert Barnes' concerns about Amy Coney-Barrett being another Wray, Mueller, Roberts being foisted upon you- be careful- see Info Wars interview.1",
2020-09-26,"Good for Cuomo! One day he will run for President & he's got my vote when that day comes! You'll still be in prison with a matching jumpsuit! But for now, Biden is gonna beat you very very soon, very very badly. Like no one has ever seen before. ",['#TrumpForPrison20203']
2020-09-26,False and this coming from someone who scammed students at Trump University When they took classes in Real estate1,
2020-09-26,"Speaking of nursing homes, how about you ask  why she did NOTHING to protect the residents in the one in Elizabethtown NY? Both staff and residents are infected with COVID19 and the death toll there is going up? We have an outbreak while she poses with cops.12",
2020-09-26,"All jokes aside, there better be some arrests made shortly... and not just the little pawns either. They better be arresting from the top on down! Drain that swamp until it becomes a desert!2",
2020-09-26,tell Barr to arrest them NOW please!!!!16,
2020-09-26,so no need to keep Reality Winner locked up then..  ,"['#freeRealityWinner', '#realityWinner1']"
2020-09-26,Twitter is clearly interfering with this election  4,
2020-09-26,"Honestly Sir this will be the one time I would agree with that murderous thug Cuomo. I will not take a vaccine. Not for a virus that I have a 99.5% chance of surviving.Seems to be a bit of over-KILL But hey, let others die from the vaccine. Its still a free country.12222",
2020-09-26,"Trump has been America’s DISASTERHe’s without doubt a profoundly damaged human being with no true understanding of his capacities, his emotions, his ignorance, his job or the fundamentals of human decencyHistory will record & remember him as the WORST President in US history!1",
2020-09-26,"How many intelligence, military, frmr aides, frmr EVERYTHING in your admin have spoken out against your leadership?! That speaks volumes.1",
2020-09-26,"SCOTUS sit 1 wk after Election to decide the fate of ACA and133 mill with pre existing conditions21 mill on ACA12 mill on Medicade800,000 with Opioid addictionsand they will all lose their coverage under Republican stooges in SCOTUSIN A PANDEMIC14",
2020-09-26,That's right! 11,
2020-09-26,People are saying you bought your vaccine from Russia1114,
2020-09-26,"Governor Cuomo is everything you’re not, which is a great thing. Donnie is jealous!19",
2020-09-27,China Virus Cover-up: Dr. Li-Meng Yan discusses how the Chinese communist regime covered up the origins of the deadly China Virus.   :2628.6 Lou Dobbs 33,"['#MAGA', '#AmericaFirst', '#Dobbs5']"
2020-09-27," * 7 MILLION CASES IN USA FROM COVID-19, ALL ON TRUMP'S FAILURES! 205,000 DEATHS IN USA! onahunttoday11",
2020-09-27,"How sad it is that you are still crying about Obama.  He is an actual intelligent man.  Caring, compassionate, doesn't have to pussy grab.  You...not so much.17",
2020-09-27,GOOD vs. EVIL.4,
2020-09-27,Where's the DNA sample? And the taxes?4,
2020-09-27, you said you wanted to give us more stimulus. The democrats are screwing the American people. People are homeless and living in their cars. You need to do this executive order for stimulus!! We’re losing hope without your leadership.  Antoine Tucker for Congress NY-14,
2020-09-27,"Who is ""they said'?? One person said this was his PERCEPTION. But there were people talking illicitly to Russia, dealing with Russia and old Ukraine, letting Russia interfere in our election ON YOUR BEHALF! And you want them to do it again!3",
2020-09-27,"Tell me again how we're gonna have a , after you see these crowds in VIRGINIA.23",['#BidenHarrisLandslide2020']
2020-09-27,Don't you have a virus to spread?2112,
2020-09-27,"EXCELLENT CHOICE!Thank you for ensuring the integrity of our beloved Constitution shall endure, despite the prevalence of raging Antifa/BLM/Democrat Marxists who've laid siege to everything American in all Democrat strongholds where they've been invited in with open arms.137",
2020-09-28,So you paid seven hundred dollars - $700 - over YEARS- you need to be jailed for TAX FRAUD— LOCK HIM UP!1,
2020-09-28,$750 DOLLARS!!!!  $750 DOLLARS?!?!  Maybe the tax test would be better.   ,"['#TrumpTaxes', '#TrumpTaxReturns1215']"
2020-09-28, makes Bernard Madoff look like an under achieving small time grifter in comparison.   THIS dummy is YOUR leader? REALLY?12,
2020-09-28,"Dear Mr President do not pardon Obama for Treason against you and the people of the United States. He needs to be prosecuted for the wire tape on your office. Please arrest Susan Rice, Samantha Powers, Valerie Jarrett and Joe Biden for unmasking Gen. Flynn11",
2020-09-28," NO! You’ve been saying this for months. You have no plan. And, you will be hurting MILLIONS of Americans with preexisting conditions.     Donald J. TrumpObamacare will be replaced with a MUCH better, and FAR cheaper, alternative if it is terminated in the Supreme Court. Would be a big WIN for the USA!1","['#Trumplieseverytimehespeaks', '#LiarInChief', '#NoPlan', '#TrumpTaxReturns트윗']"
2020-09-28,please stop attacking JOE and go after the democrat establishment all working in tandem to destroy our country and keep pushing a class system  they sit at the top of12,
2020-09-28,"*Joe slowly walks on stage and starts unbuckling his pants* he gives a half smile and says, “I don’t know why y’all wanna see this”Moderator: “Joe no! DE-bate!”11",
2020-09-28,"Thanks for the chuckle, . Poor trump has no sense of humor & cannot bear to be wrong or humble. What a laughing stock.1",
2020-09-28,Another parade today supporting President Trump!  Americans need to demand our elections NOT be compromised as the socialist democrat communist are expected to do! This is the ONLY way they could beat  is if they cheated.22,"['#MAGA2020Landslide', '#Trump']"
2020-09-28,"Why haven’t you paid taxes since 2000?  Such a criminally minded president.Trump’s Taxes Show Chronic Losses and Years of Income Tax AvoidanceThe Times obtained Donald Trump’s tax information extending over more than two decades, revealing struggling properties, vast write-offs, an audit battle and hundreds of millions in debt coming due.nytimes.com3",
2020-09-28,Arrest Mini Mike. He’s a crook.1332,
2020-09-28,The Democrats and their election fraud. Bloomberg should be arrested.,['#DirtyDemocratPolitics114']
2020-09-28,Watch your taxes.12,
2020-09-28,This didn’t age well! Don-the-Con TAX FRAUD ,['#LockHimUp12']
2020-09-28,You sound strongly worried.6,
2020-09-28,"Dude, this did not age well.11",
2020-09-28,Mini Mike may need some soap on a rope12,
2020-09-29,Read this thread of people receiving numerous ballots.  https://twitter.com/andjustliketha6/status/1310578125722574851?s=19…    .11,
2020-09-29,"The only thing that has gone wrong is you, Donnie.$750 paid in income taxes? Really????2",
2020-09-29,"the ONLY way Democrats can win is if they cheat, since they no longer stand for anything American1",
2020-09-29," most of us haven't believed  in 3 to 4 decades and the rest are coming around day by day. One day soon no one even their small following won't as well. They pushed hope to their audience for 3.5 years, you would be impeached, sometime they have to wake up!!!2",['#FakeNewsMedia']
2020-09-29,"Did you agree to fact check?You know,  they say charity begins at home.... take care of your own...Drug test your family,    they are going to need to be clean before prison so that aren't withdrawing the day you all go in.1",
2020-09-29,"LOL, okay.  produced an epic feat of good ol' fashioned investigative journalism. You're just embarrassed everyone knows how much you spend on that tangle of cobwebs on your head that you call hair. Or how much you lie about spending. Unless you have $70K of receipts?1",
2020-09-29,Because he isn't an ass like you?2,
2020-09-29,"Now Fake News  is actually reporting that I wanted my daughter, Ivanka, to run with me as my Vice President in 2016 Election. Wrong and totally ridiculous. These people are sick!2.84.218.4",
2020-09-29,I bet he’s taking a dementia drug along with one of those blue pills.5,
2020-09-29,"You do a drug test.I dare you, tax cheat.22",
2020-09-29,Why should he? You’re the one on drugs8,
2020-09-29,"For the rest of us folks, that’s the same as testing “hot “4117",
2020-09-29," created 6.6 Million jobs in his first 3 years as president. He will rebuild the American economy and create more jobs post COVID while the plan from   would lose 3 million jobs.   's tax plan could destroy 3M jobs, former Trump economist projectsJoe Biden's proposal to hike taxes on corporations and wealthy Americans could dramatically shrink the nation's economy and destroy millions of jobs, according to new projections from President...foxbusiness.com86","['#SleepyJoe', '#NoContest', '#Trump2020', '#VoteRedToSaveAmericaBiden']"
2020-09-29,Tagged by twitter because YOU LIE.39,
2020-09-29, is trending.  So is  So embarrassing.34,"['#BrokeAssTrump', '#BrokeAssTrump']"
2020-09-29,Enjoy President Pepe 2,
2020-09-29,Sad when twitter has to flag the “president’s” tweets as misleading4,
2020-09-29,"""nonsense"" and ""illegally obtained information"" don't seem to jell. Which is it? Don't answer, we all know.36",
2020-09-30,so stop cheating with the Russians already boo boo1,
2020-09-30,They're lying.  You're losing highly.  Nothing you can do about it.  You have no hope.1,
2020-09-30,"You think he'll mention the tax thing, Don?1",
2020-09-30,"Chris had a tough night. Two on one was not surprising, but  fun. Many important points made, like throwing Bernie, AOC PLUS 3, and the rest, to the wolves! Radical Left is dumping Sleepy Joe. Zero Democrat enthusiasm, WEAK Leadership! The New York TimesAs the moderator of tonight's debate, Chris Wallace of Fox News repeatedly struggled to keep the proceedings coherent, reduced at times to pleading with the president to pause and allow his opponent to speak.https://nyti.ms/30j5wno32.69.6",
2020-09-30,Bullshit. It just prevents your thugs from voter suppression.1,
2020-09-30,"Its hilarious when democrats alkege Biden leading in THEIR OWN poll, of THEIR OWN voter base.Like... Republicans would take part in a democrat poll.Like... they would admit Trump leading in THEIR OWN poll.As if... pfft!1",
2020-09-30,"When Joe Biden tugs on his ears, ask him if it's time for a new battery1",
2020-09-30,So ... much ... lying.1,
2020-09-30, round up all illegals and deport them or they will be voting1,
2020-09-30,"They're quoting people who worked with you. And, none of us would be surprised if you wanted Ivanka as your Veep...or as your next wife.2",
2020-09-30,"Yet another nugget to shove in Joe's face...He's going to need his drugs 5 minutes into this Debate!   Maria BartiromoBREAKING: declassified 9-7-2016, U.S. intel officials forwarded investigative referral to FBI Comey & Strzok re candidate Hillary Clinton's approval of plan4candidate Trump & hackers hampering election as a means of distracting the public from her use of a private mail server.’”12","['#DrugTestJoe', '#JoeHasEarpiece트윗']"
2020-09-30,"Another great state, let’s see how long it takes for you to criticize your opponent rather than facing the topics you’ve so miserably failed at!1",
2020-09-30,We will have a fair election when your voted out of the White House!21,
2020-09-30,You still play that broken record?1,
2020-09-30, will not come back and he’ll go to prison for his mistakes.Hello Mr president  you’re our president.You have our votes . Perhaps  don’t have ability or power to make America great again but  can make the world  great again.1,"['#Trump', '#democrats']"
2020-09-30,Fake media will do and say anything to chastise you. I admire your tenacity Mr. President.1,
2020-09-30,None of us were...I mean literally NO-ONE on Earth considering Joe Biden says he's been in the Senate for 180 years! Rep. Matt GaetzI wasn't even born. twitter.com/Jim_Jordan/sta…112,
2020-09-30,"Anything to do with you, or anything you touch, is unconscionable.3",
2020-09-30,Keep trying. You desperate loathsome thing. Keep trying.2,
2020-09-30,"Relax, sit back and enjoy ...the officials have it covered LEGALLY. You don’t get to do their jobs for them. Try sticking to yours.4",
2020-10-01,Nevada is in trouble!!! Sisolak need to be investigated!2621,
2020-10-01,"Thank you Duluth, Minnesota!0:06Team Trump (Text VOTE to 88022)LIVE: President Donald Trump in Duluth, MN  Text VOTE to 88022pscp.tv4.31.45.5",['#Minnesota']
2020-10-01,This is your USA you idiot! Joe isn’t president until January!2,
2020-10-01,WE LOVE AND SUPPORT YOU MORE THAN EVER PRESIDENT TRUMP!!!    GIF4,"['#Trump2020', '#Trump2020NowMoreThanEver']"
2020-10-01,"Come on out Boss, we are waitin' on ya . . .14",
