date,text,hash_tags
2020-09-10,"""I'm a low-life who is known for disinformation, and the Democrats have taken my false words and put them into a TV commercial.  I am a BIG LIE!  All I do is LIE!  VOTE ME OUT!  Biden should be President!""1",
2020-09-10,Who’s kissing who’s ass tonight?12,
2020-09-10,"And yet approaching the end of your four years (), Flint doesn’t have clean water. Corona has killed over 6800 michiganders. Your callous shamelessness never disappoints, however expected it is in your constantly evolving vengeful teardown loop(s)1",
2020-09-11,"""Didn’t he have an obligation to do so?""YOU HAD THAT OBLIGATION. But you were more worried about the stock market (which is clearly NOT the 'economy')",
2020-09-11,"Landslide coming. But Mr Trump, when you do win, PLEASE do more for environmental issues. We all need somewhere to live & need to leave it healthy for our kids & Grandkids .               2",
2020-09-11,"Unless you've seen him , he could still be dead. That's how  operate. You need to learn more about , if you ever want to be good at it.11","['#in_person', '#CommunistRegimes', '#fascist_dictators']"
2020-09-11,You are purposely exposing your cult base to Covid. It’s all about you.You are evil1,
2020-09-11," Where’s your plan for healthcare?  Where’s your plan for the economy?  Where’s your plan for racial equity?  You have NO Republican platform. Are you all planning to do anything except lie, cheat and party with dictators?2",
2020-09-11,    If right now isn't the time for emergency use of the  we're all going to be sick and dying. Why will nobody stop this insanity???Trump knew and for selfish reasons he kept lying about CovidIMPEACH HIM23,['#25thAmendment']
2020-09-11,"I have taken the toughest-ever action to stand up to China’s rampant theft of Michigan jobs. Sleepy Joe Biden has vowed to remove those Tariffs and allow China to resume its pillaging. Joe Biden’s Agenda is Made in China, my agenda is Made in the USA!1.31.86.5",
2020-09-11,I will believe the Sun rises from the West before I believe ONE ugly word told by the Trump haters!  I hope those lying neverTrumpers all get to be punished as traitors because they have LOST their BASIC HUMAN DECENCY!1,
2020-09-11,I feel bad for them.3,
2020-09-11,Golf complain and campaign while you bankrupt America. Tough gig.13,
2020-09-11,Joe Biden’s America. Portland thugs just endorsed him.11,
2020-09-11,Oh what tangle webs ypu weave when first you choose to deceive!  ,"['#TrumpLiesPeopleDie', '#TrumpKnew2']"
2020-09-11,Welcome to our State Mr. PRESIDENT!15,
2020-09-11,Nobody cares what you think Donald Duck and cover. The only ones who do are your followers12,
2020-09-11,Those were your words for the public.  Most of us know your true feelings because you've given us a glimpse into your heart and it isn't pretty.5,
2020-09-11,Close the doors and bar the gates!  Hide the women and children!6,
2020-09-11,Welcome best President ever!!!!Trump 2020!!127,
2020-09-11,"No thanks, got better things to do like pull a tooth, break a bone etc.!!3",
2020-09-11,"Attention all , including all Tv Stations, Newspapers, Digital Outlets MUST DEMAND  resign immediately or the  Cowards due their jobs and remove .    ","['#MSM', '#DopeyDon', '#GOP', '#Trump', '#TrumpKnew', '#TrumpGenocide', '#TrumpLiedPeopleDied24']"
2020-09-11,How’s the flight bro3,
2020-09-12,"Blue states have been financing red states for decades, donnie boy! The economy is failing and will continue to until the Pandemic is controlled.        ","['#TraitorTrump', '#CorruptGop', '#MoscowMitch', '#PutinsPompeo', '#ImpeachBarr', '#RecordUnemployment', '#America1stCOVID19Cases', '#TrumpDeathToll197K12']"
2020-09-12," does not know the Pledge of Allegiance and  is as unAmerican as her ""husband"" .1",
2020-09-12,Only thing you've made in USA is 200K dead Americans with 200K more due by New Years from  8645&GOP113201,['#TrumpVirus']
2020-09-12,"       Why in the HELL ARE DEMOCRATS WHO BROKE THE LAW LIED TO CONGRESS, WIPED PHONES CLEAN, TREASON, EXTORTIONECT. NOT BE CHARGED WITH CRIMES AND PUT IN JAIL. SICK OF THIS MESS.11",
2020-09-12,"You said you didn't want to panic ppl about COVID-19 but you don't mind stoking the flames of fear, hatred, panic over scary ol' Antifa, POC moving into suburbs. Talking out of both sides of your mouth isn't working for you.1",
2020-09-12,Great! Kevin W.This act of kindness deserves to be shared !!!15.124.8,
2020-09-12,You’reNOTa politician! What’s going on in America needs to be SOLVED! Politicians argue and go home on vacation!YOU ARE a businessman and you KNOW the people are falling apart. GET THEM MONEY! Executive Order something. The People are sayin we need green ,['#KAG20202']
2020-09-12,"When you attack & punish democratic governors in democratic states, you’re also punishing the citizens of those states. All American citizens of those states with mixed political affiliations; republican, Democrat, independent. You’re a pathetic, small, poor excuse of a man.1",
2020-09-12,"Your the worst president EVER, third world countries have had  better president's than you. Resign already and let us get on with our lives!1",
2020-09-12,Jesus you shoveling the bullshit deep here even for you trump.... careful trump you might cause that panic you claimed you try to prevent n is why you LIED ABOUT COVID-19115,
2020-09-12, Has tried all he could but he must find the funds somewhere else by EO! The Dems will drag this out until after the election! Henry RodgersJust Now: EVERY Democrat in the Senate voted to block the passage of a coronavirus stimulus package after months of stalled negotiations between Democrats and Republicans. Read more here: https://dailycaller.com/2020/09/10/senate-democrats-block-coronavirus-stimulus-package/…11,
2020-09-12, again this is why I support you  MAGA133,['#Trump2020']
2020-09-12," please sign an executive order instituting the Death Penalty for arson immediately, before our entire state burns down!2",
2020-09-13,They just don’t get it! https://twitter.com/KenWebsterII/status/1305147262025203712…    .7.41.25,
2020-09-13,Just landed in Nevada but while on Air Force One watched most vicious TV commercial I have ever seen. Pathetic Joe’s people placed an unsourced ad where they have me saying unthinkable things about soldiers while standing over their graves. It is a MADE UP LIE. A TOTAL CON JOB!3.5414.7,
2020-09-13,The world loves you Mr. President!16,
2020-09-13, SMOKE COMPROMISES THE LUNGS AND COVID LOVES YOU AS ITS HERO!    ,['#TrumpKillsForVotes2']
2020-09-13,Has Biden had anything like this?  Hard to do in Mama's basement19125,
2020-09-13,Clearly demonstrates no demand for these signs elsewhere.13,
2020-09-13,Looks like tombstones!2,
2020-09-13,BIDEN HAS BEEN PUT TO BED BY NOW LOL23,
2020-09-13," I was privileged to attend a Trump rally.Uplifting, positive message for America. Unleashed enthusiasm because you are the People’s President; our President.Lord Jesus, give America your protection, and by your grace, 4 more years with President Trump. Amen. Donald J. TrumpON MY WAY — SEE YOU SOON!131",
2020-09-13,"Where’s the book burning at tonight, sir?5",
2020-09-13,I'm in PA Today I recv'd 4 mail in ballot requests in my mailbox. Only 2 people in the household. I'm getting emails about it too.98,
2020-09-13,“Mail-Vote Madness in Pennsylvania - The swing state is heading toward an election crackup that could draw the entire country into a legal brawl.”. of Pennsylvania should not be allowed to defraud the PEOPLE of the UNITED STATES!Opinion | Mail-Vote Madness in PennsylvaniaThe swing state is heading toward an election crackup that could draw the entire country into a legal brawl.wsj.com4.81.23.3,
2020-09-13,God speed! 324,
2020-09-13,"On my way, Nevada!81.612.4",
2020-09-13,God bless both these men.1,
2020-09-13,I did more in 47 months as President than Sleepy Joe Biden did in 47 years! .7 0:02 / 1:10Team Trump (Text VOTE to 88022) 1.42.17.6,['#MAGA175']
2020-09-14,Trump caused current economic depression. ,['#TheTrumpDepression6']
2020-09-14,"When will  paint Black Lives Matter in front of his home? You know, to show respect1",
2020-09-14,Of course you didn’t ask for their statements.  How did I know you were gonna say that?1,
2020-09-14,Hahahahaha!  Poor baby doesn't like it that his words have come back to bite him in the heinie...2,
2020-09-14,"...And we’re not finished yet. All coming together like a highly complex, but beautiful, puzzle! Omri CerenYou guys gonna do a followup on this one? twitter.com/nytpolitics/st…2.49.23.4",
2020-09-14,"More harm to unity, morals, values, principles, integrity and telling the truth.  Oh yes, you definitely did more.1",
2020-09-14,Trump is as good of a strategist as he is being a man of GOD .... NOT!!!!2,
2020-09-14,"Gary is not one of ""them"". I know him. Great guy. Amen.325",
2020-09-14,You're never right. Anyone with an IQ over 10 and common sense criticizes you.15,
2020-09-14,YOU ARE LYING!  HE'S LYING EVERYONE!  THIS WILL NEVER HAPPEN!  HE IS RUNNING SCARED.  YOU WILL HEAR OF ALL KINDS OF THINGS HE WILL BE 'SIGNING'. NOTHING WILL BECOME OF IT EXCEPT SS AND MC.  THOSE WILL BE TAKEN DOWN!3,
2020-09-14,"Pres. Trump is an anomaly in a long line of presidents.  He cannot be bought, cannot be intimidated or leveraged, cannot be out-trumped! ",['#BestPeacePresidentEver452']
2020-09-14,They are the scum of the Earth.10,
2020-09-14,I think we should be very concerned with the Transition Integrity Project led by wealthy power hungry democrats and republicans who will stop at nothing to take  out of office. It’s scary what they are planning.  It’s a full on attack.  We can NOT let this happen!1611,
2020-09-14,Oh Whoa Is Me!This from one of your Losers!      .  ,
2020-09-14,You’re fu**ing insane.. Let’s focus on the fact that the US = 4.5% of the world population but 25% of the worldwide  deaths. You “played it down” and continue to “play it down”. The result of your incompetence is a prolonged economic catastrophe that didn’t need to happen12,['#COVID19']
2020-09-14, You were wrong. You are wrong. You will continue to be wrong. All of America criticizes you because you are wrong.  And dumb. Profoundly stupid and corrupt. Your only supporters are either stupid or corrupt. What an unholy combination.2,
2020-09-14,250000 all dead on Trump’s watch! Murderer!6,
2020-09-15,They did & you had them shot with rubber bullets and tear gas ,['#VoteBidenHarrisToEndThisNightmare26']
2020-09-15,"For a flag-hugging, (supposed) constitution-loving cockwomble, it’s incredible how often you forget that lovely little thing called the first amendment. 14",
2020-09-15,Is there just one day you don’t fucken whine about something ??? Shut up already and do your job that you have absolutely no clue on running !1,
2020-09-15,"My team and I are closely monitoring extremely dangerous Hurricane Sally. We are fully engaged with State & Local Leaders to assist the great people of Alabama, Louisiana, and Mississippi. Be ready and listen to State and Local Leaders! 9.21.36",
2020-09-15,Remember the words of The National Anthem during your first minute in solitary confinement.1,
2020-09-15,"The true price of freedom is respecting the freedom of your fellow citizens. Castigating Americans for actually using the freedom that we’ve sworn to uphold and defend is...silly. The right to protest is guaranteed, and that’s all there is to it.14",
2020-09-15,"Like at one of your covid spreaders... err I mean, rallies you mean?1",
2020-09-15,Don't you have a doctor's appointment now?14,
2020-09-15,Killing off his own Voter’s. Shows his mentality.2,
2020-09-15," is a disgrace! So disappointing! Will not watch until players can stand for our national anthem! If they kneel, they should open a bible in prayer for the blessing the good lord has bestowed upon them!1",
2020-09-15,"You should just resign, seriously, you’re killing Americans, and please know that no matter what, you are going to jail, whether it’s after this November, or in 4 years. You are going to JAIL.   ","['#WoodwardTapes', '#TrumpKnew', '#DonTheCon13']"
2020-09-15," tRump, Putin, and Un are psychotic!   is smart, compassionate, empathetic, presidential.2",['#TrumpIsUnwell']
2020-09-15,Should the millionaires & billionaires that donate to your campaign be ashamed of themselves? Or what of your sycophants at FOX should they be ashamed? You are such a hypocrite Donald.12,
2020-09-15,What a beautiful puzzle it is.Z147,
2020-09-15,My dog is more mentally fit than Biden.210,
2020-09-15,"Like a little kid, isn't he? A little psychopathic, authoritarian kid.2",
2020-09-15," for those that want student loan to be forgiven, how many a national program that would employee qualified graduates to commit 4 years service in law enforcement, the military, Teach for America, or the Border Patrol for total debt forgiveness? ",
2020-09-15, know you’re bringing this subject up?   Senator John CornynI’ve spent my career in the Senate fighting against child abuse and preventing the exploitation of our most vulnerable Texans.  twitter.com/JohnCornyn/sta…111,"['#TrumpIsARapist', '#TrumpIsNotWell트윗', '#CancelCuties']"
2020-09-15," you are not a scientist, you are chaos in orange paint.    The Washington PostOpinion: Climate change forces itself into the presidential race https://wapo.st/2FwBwNw12",['#ScienceDenierTrumpFires트윗']
2020-09-16,Good thing you were fully committed to the fires on the weary coast1,
2020-09-16,"Really, at your weight and age, you may want to consider healthy choices. We want to make sure you get to experience all prison has in store for you, criminal? ","['#WorstPresidentEver', '#TrumpLiedAmericansDied1']"
2020-09-16,Trump posing in front of food would make a great surrealist coffee table book (if coffee table books were still a thing)113,
2020-09-16,"Trump is absolutely going to win.  I was worried for awhile. Peace Agreements, Stock Markets.  Jobs are coming back. offers nothing but segregation.1",
2020-09-16," *South Carolina - Tell Sen. Lindsey Graham That Jamie Released His Taxes! Hey, How About Donald J. Trump? Thor Benson  11",
2020-09-16,"« Greater than Cyrus the Great » “President Trump will bring peace in the Middle East” Bible CodeSo it is written, so it is done! ",['#KAG11']
2020-09-16,Is that Pat's AND Geno's?3,
2020-09-16,Biden would never do that!3,
2020-09-16,Yummy! Philadelphia cheesesteak. 3,
2020-09-16,Please eat more than just 2!! PLEASE!4,
2020-09-16,"Good Luck Mr. PRESIDENT,“Lets do this thing, give it to um-   Dont forget to flex that suit! You got this,  got you!  We believe in you- Get um  2","['#OFFENSE', '#WTP']"
2020-09-16,"It’s like watching cartoon characters... the difference, Elmer Fudd has a higher IQ...14",
2020-09-16,We already know they are going to cut off half of your answers and edit the other half. Too bad you didn't do it as a Rally with questioners where it could be filmed and shown in its entirety by 13,
2020-09-16,Love that Philadelphia cheesesteak.718,
2020-09-16,Pass.  I have had enough of your babbling on and on and lying for the past four years.  I can not take another minute of hearing you whine about how your failures are everyone else's fault.14,
2020-09-16,"Yes I saw the ad, (Protect Our Troops) that you put out using RUSSIA FIGHTER JETS and MILITARY WEAPONS! Question; Who's troops are you protecting? the ad left me wondering!1",
2020-09-17," *Trump LIED LAST NIGHT!  Liar In Chief! We The People, Are Done With Trump's Lying! Evidence-based Suki twitter.com/ddale8/status/…11",['#TrumpLies']
2020-09-17,It is bad enough you lie for yourself. Let the honest candidate be exactly that ,['#TrumpLied200KDied11']
2020-09-17,America made a mistake too. They voted for Trump.1,
2020-09-17, you need to get rid of this clown immediately1,
2020-09-17," of all your people that were indicted and did time I believe Michael Cohen the most. His book is fabulous. And he has nothing to lose by telling the truth. youngallison63On CNN Cohen says he once heard Trumpy say re:Putin-""See it doesn't really matter who u vote 4; it just matters who counts the votes."" Says he idolizes Putin's takeover of an entire country~ Swears Trump will not leave office w/o a fight- will claim it's rigged & dump ballots!1",
2020-09-17,This is one thing sir that I will respectfully disagree with you over. The history of vaccines speaks volumes in & when you can find the information.12,
2020-09-17," BTW  ""Herd mentality"" is what non maskers in a Trump crowd do, ""herd immunity, a scientific term,  is what Sweden tried and miserably failed to contain Covid doing.      ","['#HerdMentality', '#HerdStupidity', '#HerdImmunity11']"
2020-09-17,You did abysmally--as expected.1,
2020-09-17,Name 3 teams in the big ten.2,
2020-09-17,That’s a lie.25,
2020-09-17,How much bleach did you add?1,
2020-09-17,"I'll let the MAGAt herd try it first, as a test of their loyalty to you.3",
2020-09-17,"much to the chagrin of the pandemocrats who would like to see more death and destitution, so as to blame it on the orange mantheyre fine with more fellow citizens dying..as long as it gets rid of drumpf3",
2020-09-17,But the Ukraine aid?  ,"['#Hypocrite', '#PelosiMustGo13']"
2020-09-17,You got horrible ratings cuz no one watched!127,
2020-09-17,Trump you and Republicans are “heartless”. The Democrats in the House passed the Heroes Act back in May the GOP Senators have not passed anything. This is why NO STIMULUS PAYMENTS to people who desperately need the money is available.34,
2020-09-17,I don't believe anything you say.14,
2020-09-17,Doctored video.3,
2020-09-18,"...egregious behavior, which is just the way they want it. This was not a mistake, it was done illegally and on purpose. We want Mike!Democrat Michigan Secretary of State Misprints Trump Ticket on Ballots for TroopsThe Michigan secretary of state misprinted the Trump line on ballots intended to be mailed to troops serving overseas. | Politicsbreitbart.com2.71.23.4",
2020-09-18,"I guess ur well versed in ""ELECTION INTERFERENCE by foreign countries"" since that's how you got into the WH in 2016! Yes it has caused ""massive choas and confusion"" Because you definitely were not elected! By the American people! Never have never will be! Please read responses!1",
2020-09-18,Just out! Former assistant of Pence and member of the tRump virus task force let’s the cat out of the bag on how you can’t stand your worshippers!1,
2020-09-18,Do you have a damn clue why vaccines take time?  Even an inkling of a clue?  Potential side effects on you.  ALL ON YOU.  You are already guilty of tens of thousands of American deaths.12,
2020-09-18, is losing across America. His campaign is broke. He couldn’t afford to fly anywhere if he weren’t using government resources. Pathetic!    ,"['#TrumpIsALoser', '#TrumpWantsToInfectUs', '#TrumpDeathToll200K', '#VoteBidenHarris20202']"
2020-09-18,Beautiful ceremony. With Dignity and Grace we stand with you in honour of those who serve truth and stand to uphold it. Thank you for all you have done and continue to achieve to forge a higher path and purpose Sir! We love you.24,
2020-09-18,Why isn't she being charged with voter fraud.  These Democrats have planned out all kinds of ways to cheat.  God help us.12,
2020-09-18,No. We're angry that you're still trying to murder Americans in ALL states11,
2020-09-18, ji Sir Introduce AI Farming Technology+Data Science+ Need And Demand Perspective Make America Greatest InFarmingAmerica Blessed With Good Agriculture Lands It Helps  ji To Make Hindusthan 10Trillion Economy Too.Hope You BothStillAreFellas Yahoo FinanceTrump to announce $13 billion in farm aid on Thursday: Reuters https://yhoo.it/2RPnZU911,
2020-09-18,"If Biden Wins, CHINA WINS. If Biden Wins, the mob WINS. If Biden Wins, the rioters, anarchists, arsonists, and flag-burners WIN. I am running for re-election to bring jobs and factories back to Wisconsin, to put violent criminals behind bars, and to ensure the future belongs...8.81.96.8",
2020-09-18,"No, we are not angry there is a vaccine.  It wont be ready for the public by November 3rd.Pfizer said maybe 10-31 then approval takes a few weeks. They will have 100000 vaccines and those would go to HC workers and some high risk. Others wait till 2021.1",
2020-09-18,And you registered to vote with the wrong address.Village I.D.I.O.T.15,
2020-09-18,"I’m confused, the military should have their ballots sent out by Friday, which is tomorrow. Somehow that is a disaster, yesterday. Don’t we need to wait until next week to see if they got them?3",
2020-09-18,"There is nothing good to trend about you.  We are still waiting: health care plan, punishment for Russia, who is confirmed as still interfering in the election, as well as had bounties on our soldiers. We are waiting for another check for assistance.. so that's what we're saying3",
2020-09-18,"Donald Trump is a tired old gas bag who is good at only one thing — whinning.As for the mid-East deal, Woodward's book was already done and published. Low ratings Trump is the one who is washed up as President. He's useless and done in November.2",
2020-09-19,3 years too late to make a difference. You still will lose.28,
2020-09-19,"Shut the actual BLEEP up. Seriously, no one cares.1",
2020-09-19,Shut up Goon.1,
2020-09-19, is absolutely killing it in MN! Just called out  and  for all the reasons we know but MSM ignores.I love this man!!! ,"['#BlackVotersForTrump', '#Trump2020Landslide12']"
2020-09-19,"Mr. President now that Justice Ginsburg has died your greatest battle has begun... We must re-elect You, keep control of the Senate & take back the Congress or our Constitutional Republic & Freedoms will be the next to die...13",
2020-09-19,".  We were put in this position of power and importance to make decisions for the people who so proudly elected us, the most important of which has long been considered to be the selection of United States Supreme Court Justices. We have this obligation, without delay!7.29.130",
2020-09-19,"I hope they use it correctly, without all the corruption.",
2020-09-19,"“When someone shows you who they are, believe them the first time.” ~Maya Angelou12",
2020-09-19,RESIGN now.2,
2020-09-19,It’s hysterical watching  throw Hail Mary’s.2,
2020-09-19,"He’s probably won more battles than you could even Fathom, & without cheating. He won’t be looking for a country to sneak away to in the middle of the night, fighting extradition the remainder of his life, & I doubt his assets will ever get frozen.4",
2020-09-19,"Mini Mike Bloomberg, after making a total fool of himself as he got badly beaten up by Pocahontas and the Democrats in the Primaries, is at it again. He tried to buy an Election and went away with a major case of Depression. Now he’s throwing money at the Dems, looking for a job!1.727.9",
2020-09-19,Trying to buy votes looks ugly.  You are 3 years too late with your FEMA $$24,
2020-09-19,"A conundrum. Either an error so egregious as to be unfit for office including the entire staff, or outrageous fraudulent cheating.34",
2020-09-19,Blatant bribery. How insulting to those of Puerto Rican heritage.19,
2020-09-19," : We 'Hindus' are increasingly feeling that the hate-filled Islamist mobs will be attacking us.I will hold U.S. accountable What is this...?  Sam Westrop1/ American Islamists have firmly set their sights on India. The Dallas-Fort Worth branch of the terror-tied Council on American-Islamic Relations (CAIR-DFW) is looking to hire interns to ""monitor the troubling rise of Hindutva activities in the U.S.""http://cairdfw.org/outreach/events-updates/128-hate-monitor-intern-hindutva-cair-tx-dfw?fbclid=IwAR3lq4Zv2AYevqLDTXGNWja_7WYPHzsKCGMnD0K6b3WjynatpcNhsyFvd-A…  11413",
2020-09-19,They go on true evidence... not lies !11,
2020-09-20," polled the audience, because he represents the people, and the Women won by a huge landslide. Brilliant RestlessGypsyHe's gonna pick a woman. Oh man, the show is getting interesting. How will those liberals handle that one. Epic congressional cat-fight scene coming up.GIF1",
2020-09-20,"A giant SCAM, and the Dems know it! Sara A. Carter  4.81.44.8",
2020-09-20,No.  is in place as is precedent. The next president will appoint the next justice. Don’t even think about it.2,['#MCCONNELLRULE']
2020-09-20," THE BOSS or more affectionately, BIG DADDY, has so much energy he puts OPEC to shame. Day after day, this man is incredible!1",
2020-09-20,"What was that about the “people who elected us”? You couldn’t even get a majority the first time. After this stunt, you won’t get it a second time.1",
2020-09-20,"The majority of Americans DID NOT ELECT you. Therefore the majority of Americans DO NOT support the far right, conservative agenda. God, can November 3 please hurry!!  ","['#BidenHarris', '#VoteBlueToSaveAmerica1']"
2020-09-20,"  Marquette Univ. survey results on Sat. showed 67% of adults believed the Senate should hold hearing with only 32% opposition. Similar numbers across GOP, Dems & independents, who supported holding confirmation hearings at 68-31%, 63-37%, and 71-28% respectively.1",
2020-09-20,From what I read yesterday you’re at 40% and nobody’s really been below 38% ever so that means you’re basically at 0% nobody likes you nobody wants you in our house. You should just pack your bags n run to Russia now while you still have a chance.1,
2020-09-20,"Yes, do it quickly !12",
2020-09-20,Please do.11,
2020-09-20,Amen2,
2020-09-20, just said about  before he came out to speak recently:  “They gave him a big fat shot in the ass. “. 1,
2020-09-20, should these be considered legitimate threats ? Especially by  what is he going to burn down exactly? Jay CarusoDo they really think these threats are helpful?111,
2020-09-20,So who wrote that? I’m sure is wasn’t DJT.13,
